{
  "schemaVersion": "1.0",
  "api": "TradingViewApi.webscene-interop-api.json",
  "apiFingerprint": "55f0efb59a9f2a7e4925675fac135764ae9ca540abde30a39e769498f9e5d525",
  "namespace": "TradingViewInterop.Generated",
  "typeMappings": {},
  "models": [
    {
      "source": "Charting_Library.ResolutionString",
      "name": "ResolutionString"
    },
    {
      "source": "Charting_Library.ChartingLibraryWidgetOptions",
      "name": "TradingViewWidgetOptions"
    },
    {
      "source": "Charting_Library.SetSymbolOptions",
      "name": "SetSymbolOptions"
    },
    {
      "source": "Datafeed.DatafeedConfiguration",
      "name": "DatafeedConfiguration"
    },
    {
      "source": "Datafeed.Exchange",
      "name": "Exchange"
    },
    {
      "source": "Datafeed.LibrarySymbolInfo",
      "name": "LibrarySymbolInfo"
    },
    {
      "source": "Datafeed.PeriodParams",
      "name": "PeriodParams"
    },
    {
      "source": "Datafeed.Bar",
      "name": "Bar"
    },
    {
      "source": "Datafeed.HistoryMetadata",
      "name": "HistoryMetadata"
    },
    {
      "source": "Datafeed.SearchSymbolResultItem",
      "name": "SearchSymbolResultItem"
    },
    {
      "source": "Datafeed.QuoteData",
      "name": "QuoteData"
    },
    {
      "source": "Broker.Order",
      "name": "Order"
    },
    {
      "source": "Broker.OrderStatus",
      "name": "OrderStatus"
    },
    {
      "source": "Broker.Side",
      "name": "Side"
    },
    {
      "source": "Broker.Position",
      "name": "Position"
    },
    {
      "source": "Broker.Execution",
      "name": "Execution"
    },
    {
      "source": "Broker.PreOrder",
      "name": "PreOrder"
    },
    {
      "source": "Broker.OrderResult",
      "name": "OrderResult"
    },
    {
      "source": "Broker.AccountManagerInfo",
      "name": "AccountManagerInfo"
    }
  ],
  "adapters": [
    {
      "source": "Datafeed.IDatafeedChartApi",
      "name": "TradingViewDatafeed"
    },
    {
      "source": "Broker.IBrokerTerminal",
      "name": "TradingViewBroker"
    }
  ],
  "bindings": [
    {
      "source": "Charting_Library.widget",
      "name": "TradingViewWidget",
      "constructor": {
        "globalName": "TradingView.widget",
        "name": "CreateAsync"
      },
      "methods": [
        {
          "source": "activeChart"
        },
        {
          "source": "getLanguage"
        },
        {
          "source": "remove"
        }
      ]
    },
    {
      "source": "Charting_Library.IChartWidgetApi",
      "name": "TradingViewChart",
      "constructor": null,
      "methods": [
        {
          "source": "symbol"
        },
        {
          "source": "resolution"
        },
        {
          "source": "setScrollEnabled"
        },
        {
          "source": "setZoomEnabled"
        },
        {
          "source": "setSymbol",
          "omitOptionalParameters": false
        },
        {
          "source": "createOrderLine"
        },
        {
          "source": "createPositionLine"
        },
        {
          "source": "createExecutionShape"
        },
        {
          "source": "crosshairPrice"
        },
        {
          "source": "setVisibleStudies"
        }
      ]
    },
    {
      "source": "Charting_Library.IWatchedValue",
      "name": "TradingViewWatchedValue",
      "constructor": null,
      "methods": [
        {
          "source": "value"
        },
        {
          "source": "setValue"
        },
        {
          "source": "subscribe"
        }
      ]
    },
    {
      "source": "Broker.IBrokerConnectionAdapterHost",
      "name": "TradingViewBrokerHost",
      "constructor": null,
      "methods": [
        {
          "source": "orderUpdate"
        },
        {
          "source": "positionUpdate"
        },
        {
          "source": "executionUpdate"
        },
        {
          "source": "showNotification",
          "omitOptionalParameters": false
        }
      ]
    },
    {
      "source": "Charting_Library.IOrderLineAdapter",
      "name": "TradingViewOrderLine",
      "constructor": null,
      "properties": [
        {
          "source": "id"
        },
        {
          "source": "price",
          "setterName": "SetPricePropertyAsync"
        }
      ],
      "methods": [
        {
          "source": "setPrice"
        },
        {
          "source": "setQuantity"
        },
        {
          "source": "setText"
        },
        {
          "source": "remove"
        }
      ]
    },
    {
      "source": "Charting_Library.IPositionLineAdapter",
      "name": "TradingViewPositionLine",
      "constructor": null,
      "methods": [
        {
          "source": "setPrice"
        },
        {
          "source": "setQuantity"
        },
        {
          "source": "setText"
        },
        {
          "source": "remove"
        }
      ]
    },
    {
      "source": "Charting_Library.IExecutionLineAdapter",
      "name": "TradingViewExecutionLine",
      "constructor": null,
      "methods": [
        {
          "source": "setPrice"
        },
        {
          "source": "setQuantity"
        },
        {
          "source": "setText"
        },
        {
          "source": "setTime"
        },
        {
          "source": "remove"
        }
      ]
    }
  ]
}
